"Cockayne syndrome",,https://ghr.nlm.nih.gov/condition/cockayne-syndrome,,"Other signs and symptoms often include vision loss",,,,"mutations in either the ERCC6 gene (also known as CSB) or the ERCC8 gene (also known as CSA). These genes provide instructions for making proteins that are involved in repairing damaged DNA. The faulty DNA repair underlies photosensitivity in affected individuals, and researchers suspect that it also contributes to the other features of Cockayne syndrome. It is unclear how ERCC6 or ERCC8 gene mutations cause all of the varied features of this condition."
"COG5-congenital disorder of glycosylation",,https://ghr.nlm.nih.gov/condition/cog5-congenital-disorder-of-glycosylation,,"Less commonly, affected individuals can have hearing loss caused by vision impairment",,,,"COG5 gene mutations reduce the amount of COG5 protein or eliminate it completely, which disrupts protein transport. This disruption results in abnormal protein glycosylation, which can affect numerous body systems, leading to the signs and symptoms of COG5-CDG. The severity of COG5-CDG is related to the amount of COG5 protein that remains in cells."
"Cohen syndrome",,https://non-governmental/condition/cohen-syndrome,,"Other features common in this condition include worsening nearsightedness (myopia), breakdown (degeneration) of the light-sensitive tissue at the back of the eye (retinal dystrophy)",,,,"Most mutations in the VPS13B gene are believed to prevent the production of functional VPS13B protein. Studies suggest that a loss of this protein disrupts the organization of the Golgi apparatus and impairs normal glycosylation. However, it is not known how a lack of functional VPS13B protein or these cellular changes lead to the signs and symptoms of Cohen syndrome."
"COL4A1-related brain small-vessel disease",,https://ghr.nlm.nih.gov/condition/col4a1-related-brain-small-vessel-disease,,"Some affected people have an eye abnormality called Axenfeld-Rieger anomaly. Axenfeld-Rieger anomaly involves underdevelopment and eventual tearing of the colored part of the eye (iris) and a pupil that is not in the center of the eye. Other eye problems experienced by people with COL4A1-related brain small-vessel disease include clouding of the lens of the eye (cataract) and the presence of arteries that twist and turn abnormally within the light-sensitive tissue at the back of the eye (arterial retinal tortuosity). Axenfeld-Rieger anomaly and cataract can cause impaired vision. Arterial retinal tortuosity can cause episodes of bleeding within the eye following any minor trauma to the eye, leading to temporary vision loss.",,,,"The COL4A1 gene mutations that cause COL4A1-related brain small-vessel disease result in the production of a protein that disrupts the structure of type IV collagen. As a result, type IV collagen molecules cannot attach to each other to form the protein networks in basement membranes. Basement membranes without these networks are unstable, leading to weakening of the tissues that they surround. "
Coloboma,,https://ghr.nlm.nih.gov/condition/coloboma,,"Colobomas are missing pieces of tissue in structures that form the eye. ",,"Colobomas affecting the iris, which result in a ""keyhole"" appearance of the pupil, generally do not lead to vision loss. Colobomas involving the retina result in vision loss in specific parts of the visual field, generally the upper part. Large retinal colobomas or those affecting the optic nerve can cause low vision, which means vision loss that cannot be completely corrected with glasses or contact lenses.Some people with coloboma also have a condition called microphthalmia. In this condition, one or both eyeballs are abnormally small. In some affected individuals, the eyeball may appear to be completely missing; however, even in these cases some remaining eye tissue is generally present. Microphthalmia may or may not result in significant vision loss. People with coloboma may also have other eye abnormalities, including cataract, glaucoma that can damage the optic nerve, vision problems such as nearsightedness (myopia), nystagmus, or retinal detachment.",,"Coloboma may be caused by changes in many genes involved in the early development of the eye (GDF3, GDF6, MAF, OTX2, PAX6, SHH, VSX2) most of which have not been identified. The condition may also result from a chromosomal abnormality affecting one or more genes. Most genetic changes associated with coloboma have been identified only in very small numbers of affected individuals."
"Color vision deficiency",,https://ghr.nlm.nih.gov/condition/color-vision-deficiency,,"Red-green color vision defects are the most common form of color vision deficiency. Affected individuals have trouble distinguishing between some shades of red, yellow, and green. Blue-yellow color vision defects (also called tritan defects), which are rarer, cause problems with differentiating shades of blue and green and cause difficulty distinguishing dark blue from black. These two forms of color vision deficiency disrupt color perception but do not affect the sharpness of vision (visual acuity). A less common and more severe form of color vision deficiency called blue cone monochromacy causes very poor visual acuity and severely reduced color vision. Affected individuals have additional vision problems, which can include increased sensitivity to light (photophobia), involuntary back-and-forth eye movements (nystagmus), and nearsightedness (myopia). Blue cone monochromacy is sometimes considered to be a form of achromatopsia, a disorder characterized by a partial or total lack of color vision with other vision problems.",,,,"Genetic changes involving the OPN1LW or OPN1MW gene cause red-green color vision defects. These changes lead to an absence of L or M cones or to the production of abnormal opsin pigments in these cones that affect red-green color vision. Blue-yellow color vision defects result from mutations in the OPN1SW gene. These mutations lead to the premature destruction of S cones or the production of defective S cones. Impaired S cone function alters perception of the color blue, making it difficult or impossible to detect differences between shades of blue and green and causing problems with distinguishing dark blue from black."
"Complete LCAT deficiency",,https://ghr.nlm.nih.gov/condition/complete-lcat-deficiency,,"the clear front surface of the eyes (the corneas) gradually becomes cloudy. The cloudiness, which generally first appears in early childhood, consists of small grayish dots of cholesterol (opacities) distributed across the corneas. Cholesterol is a waxy, fat-like substance that is produced in the body and obtained from foods that come from animals; it aids in many functions of the body but can become harmful in excessive amounts. As complete LCAT deficiency progresses, the corneal cloudiness worsens and can lead to severely impaired vision.",,,,"LCAT gene mutations that cause complete LCAT deficiency either prevent the production of LCAT or impair both alpha-LCAT and beta-LCAT activity, reducing the enzyme's ability to attach cholesterol to lipoproteins. Impairment of this mechanism for reducing cholesterol in the body leads to cholesterol deposits in the corneas,"
"Cone-rod dystrophy",,https://ghr.nlm.nih.gov/condition/cone-rod-dystrophy,,"A group of related eye disorders that causes vision loss, which becomes more severe over time. These disorders affect the retina, In people with cone-rod dystrophy, vision loss occurs as the light-sensing cells of the retina gradually deteriorate. The first signs and symptoms of cone-rod dystrophy, which often occur in childhood, are usually decreased sharpness of vision (visual acuity) and increased sensitivity to light (photophobia). These features are typically followed by impaired color vision (dyschromatopsia), blind spots (scotomas) in the center of the visual field, and partial side (peripheral) vision loss. Over time, affected individuals develop night blindness and a worsening of their peripheral vision, which can limit independent mobility. Decreasing visual acuity makes reading increasingly difficult and most affected individuals are legally blind by mid-adulthood. As the condition progresses, individuals may develop involuntary eye movements (nystagmus).",,,,"Mutations in more than 30 genes (ABCA4, ADAM9, AIPL1, C8orf37, C21orf2, CACNA1F, CACNA2D4, CDHR1, CERKL, CNGA3, CNGB3, CNNM4, CRB1, CRX, EYS, GUCA1A, GUCY2D, KCNV2, PDE6C , PITPNM3, POC1B, PROM1, PRPH2, RAB28, RAX2, RIMS1, RPGR, RPGRIP1, SEMA4A, TTLL5, TULP1, UNC119) are known to cause cone-rod dystrophy. Approximately 20 of these genes are associated with the form of cone-rod dystrophy that is inherited in an autosomal recessive pattern. Mutations in the ABCA4 gene are the most common cause of autosomal recessive cone-rod dystrophy, accounting for 30 to 60 percent of cases. At least 10 genes have been associated with cone-rod dystrophy that is inherited in an autosomal dominant pattern. Mutations in the GUCY2D and CRX genes account for about half of these cases. Changes in at least two genes cause the X-linked form of the disorder, which is rare. Mutations in any of the genes associated with cone-rod dystrophy lead to a gradual loss of rods and cones in the retina. The progressive degeneration of these cells causes the characteristic pattern of vision loss that occurs in people with cone-rod dystrophy. "
"Congenital cataracts, facial dysmorphism, and neuropathy",,https://ghr.nlm.nih.gov/condition/congenital-cataracts-facial-dysmorphism-and-neuropathy,,"Characterized by a clouding of the lens of the eyes at birth (congenital cataracts) and other eye abnormalities, such as small or poorly developed eyes (microphthalmia) and abnormal eye movements (nystagmus).",,,,"All known individuals with CCFDN have the same mutation in both copies of the CTDP1 gene in each cell. This mutation alters the way the gene's instructions are pieced together to produce the carboxy-terminal domain phosphatase 1 protein. The altered instructions introduce a premature stop signal, resulting in an abnormally short, nonfunctional protein that cannot regulate transcription. Defective regulation of the transcription process affects the development and function of many parts of the body. It is not known how nonfunctional carboxy-terminal domain phosphatase 1 protein results in the specific signs and symptoms of CCFDN."
"Congenital dyserythropoietic anemia",,https://ghr.nlm.nih.gov/condition/congenital-dyserythropoietic-anemia,,"In adulthood, abnormalities of a specialized tissue at the back of the eye (the retina) can cause vision impairment. ",,,,"It is unclear how CDNA1 gene mutations cause the characteristic features of CDA type I.Researchers are working to determine how mutations in the SEC23B gene lead to the signs and symptoms of CDA type II."
"Congenital fibrosis of the extraocular muscles",,https://ghr.nlm.nih.gov/condition/congenital-fibrosis-of-the-extraocular-muscles,,"A disorder that affects the muscles that surround the eyes. Congenital fibrosis of the extraocular muscles prevents the normal development and function of these muscles. As a result, affected individuals are unable to move their eyes normally. Most people with this condition have difficulty looking upward, and their side-to-side eye movement may also be limited. The eyes may be misaligned such that they look in different directions (strabismus). Additionally, many people with congenital fibrosis of the extraocular muscles have droopy eyelids (ptosis), which further limits their vision.",,,,"CFEOM1 and rare cases of CFEOM3 result from mutations in the KIF21A gene. Mutations in the KIF21A gene likely alter the protein's ability to transport materials within nerve cells, preventing the normal development of these cranial nerves and the extraocular muscles they control. Abnormal function of the extraocular muscles leads to restricted eye movement and related problems with vision. Mutations in the PHOX2A gene cause CFEOM2. Mutations likely eliminate the function of the PHOX2A protein, which prevents the normal development of these cranial nerves and the extraocular muscles they control. In most cases of CFEOM3, the genetic cause of the condition is unknown. Studies suggest that a gene associated with CFEOM3 may be located near one end of chromosome 16. The gene associated with Tukel syndrome has not been identified either, although researchers think that it may be located near one end of chromosome 21."
"Congenital hyperinsulinism",,https://ghr.nlm.nih.gov/condition/congenital-hyperinsulinism,,"Repeated episodes of low blood sugar increase the risk for serious complications such as vision loss",,,,"Mutations in at least nine genes (ABCC8, GCK, GLUD1, HADH, HNF1A, HNF4A, KCNJ11, SLC16A1, UCP )have been found to cause congenital hyperinsulinism. Mutations in the ABCC8 gene are the most common known cause of the disorder. They account for this condition in approximately 40 percent of affected individuals. Less frequently, mutations in the KCNJ11 gene have been found in people with congenital hyperinsulinism. Mutations in each of the other genes associated with this condition account for only a small percentage of cases."
"Congenital stromal corneal dystrophy",,https://ghr.nlm.nih.gov/condition/congenital-stromal-corneal-dystrophy,,"An inherited eye disorder primarily affects the cornea. In people with this condition, the cornea appears cloudy and may have an irregular surface. These corneal changes lead to visual impairment, including blurring, glare, and a loss of sharp vision (reduced visual acuity). Visual impairment is often associated with additional eye abnormalities, including ""lazy eye"" (amblyopia), eyes that do not look in the same direction (strabismus), involuntary eye movements (nystagmus), and increased sensitivity to light (photophobia).",,,,"Mutations in the DCN gene lead to the production of a defective version of decorin. This abnormal protein interferes with the organization of collagen fibrils in the cornea. As poorly arranged collagen fibrils accumulate, the cornea becomes cloudy. These corneal changes lead to reduced visual acuity and related eye abnormalities."
"Costeff syndrome",,https://ghr.nlm.nih.gov/condition/costeff-syndrome,,"Characterized by vision loss. Affected people have degeneration (atrophy) of the optic nerves, which carry information from the eyes to the brain. This optic nerve atrophy often begins in infancy or early childhood and results in vision loss that worsens over time. Some affected individuals have rapid and involuntary eye movements (nystagmus) or eyes that do not look in the same direction (strabismus).",,,,"OPA3 gene mutations that result in Costeff syndrome lead to a loss of OPA3 protein function. Cells without any functional OPA3 protein have abnormally shaped mitochondria. These cells likely have reduced energy production and die sooner than normal, decreasing energy availability in the body's tissues. It is unclear why the optic nerves and the parts of the brain that control movement are particularly affected."
"Costello syndrome",,https://ghr.nlm.nih.gov/condition/costello-syndrome,,"Other signs and symptoms can include problems with vision.",,,,"Mutations in the HRAS gene cause Costello syndrome. Mutations that cause Costello syndrome lead to the production of an H-Ras protein that is abnormally turned on (active). The overactive protein directs cells to grow and divide constantly, which can lead to the development of cancerous and noncancerous tumors. It is unclear how mutations in the HRAS gene cause the other features of Costello syndrome, but many of the signs and symptoms probably result from cell overgrowth and abnormal cell division."
"Craniofacial microsomia",,https://ghr.nlm.nih.gov/condition/craniofacial-microsomia,,"Eye problems are less common in craniofacial microsomia, but some affected individuals have an unusually small eyeball (microphthalmia) or other eye abnormalities that result in vision loss.",,,,"It is unclear what genes are involved in craniofacial microsomia. "
"Craniometaphyseal dysplasia",,https://ghr.nlm.nih.gov/condition/craniometaphyseal-dysplasia,,"Compression of the cranial nerves can lead to paralyzed facial muscles (facial nerve palsy), blindness, or deafness.",,,,"Mutations in the ANKH gene that cause autosomal dominant craniometaphyseal dysplasia may decrease the ANKH protein's ability to transport pyrophosphate out of cells. Reduced levels of pyrophosphate can increase bone mineralization, contributing to the bone overgrowth seen in craniometaphyseal dysplasia. Why long bones are shaped differently and only the skull bones become thicker in people with this condition remains unclear."
"Crouzon syndrome",,https://ghr.nlm.nih.gov/condition/crouzon-syndrome,,"Many features of Crouzon syndrome result from the premature fusion of the skull bones. Abnormal growth of these bones leads to wide-set, bulging eyes and vision problems caused by shallow eye sockets; eyes that do not point in the same direction (strabismus);",,,,"Mutations in the FGFR2 gene probably overstimulate signaling by the FGFR2 protein, which causes the bones of the skull to fuse prematurely."
"Cyclic vomiting syndrome",,https://ghr.nlm.nih.gov/condition/cyclic-vomiting-syndrome,,"Additional symptoms can include an increased sensitivity to light (photophobia) ",,,,"the causes of cyclic vomiting syndrome have yet to be determined,Some cases of cyclic vomiting syndrome, particularly those that begin in childhood, may be related to changes in mitochondrial DNA"
Cystinosis,,https://ghr.nlm.nih.gov/condition/cystinosis,,"By about the age of 2, cystine crystals may be present in the clear covering of the eye (cornea). Other signs and symptoms that may occur in untreated people, especially after adolescence, include muscle deterioration, blindness, People with non-nephropathic or ocular cystinosis typically experience photophobia due to cystine crystals in the cornea",,,,"All three types of cystinosis are caused by mutations in the CTNS gene. Mutations in this gene lead to a deficiency of a transporter protein called cystinosin. Within cells, this protein normally moves cystine out of the lysosomes, which are compartments in the cell that digest and recycle materials. When cystinosin is defective or missing, cystine accumulates and forms crystals in the lysosomes. The buildup of cystine damages cells in the kidneys and eyes and may also affect other organs."
"D-bifunctional protein deficiency/ pseudo-Zellweger syndrome.",,https://ghr.nlm.nih.gov/condition/d-bifunctional-protein-deficiency,,"As the condition gets worse, affected children develop loss of vision.",,,,"HSD17B4 gene mutations that cause D-bifunctional protein deficiency can affect one or both of the protein's functions; however, this distinction does not seem to affect the severity or features of the disorder. Impairment of one or both of the protein's enzymatic activities prevents the D-bifunctional protein from breaking down fatty acids efficiently. As a result, these fatty acids accumulate in the body. It is unclear how fatty acid accumulation leads to the specific neurological and non-neurological features of D-bifunctional protein deficiency. However, the accumulation may result in abnormal development of the brain and the breakdown of myelin, which is the covering that protects nerves and promotes the efficient transmission of nerve impulses. Destruction of myelin leads to a loss of myelin-containing tissue (white matter) in the brain and spinal cord; loss of white matter is described as leukodystrophy. Abnormal brain development and leukodystrophy likely underlie the neurological abnormalities that occur in D-bifunctional protein deficiency."
"Dandy-Walker malformation",,https://ghr.nlm.nih.gov/condition/dandy-walker-malformation,,"While rare, vision problems can be feature of this condition.",,,,"Dandy-Walker malformation most often occurs in people with trisomy 18 (an extra copy of chromosome 18), but can also occur in people with trisomy 13, trisomy 21, or trisomy 9. This condition can also be associated with missing (deletions) or copied (duplications) pieces of certain chromosomes. Dandy-Walker malformation can also be a feature of genetic syndromes that are caused by mutations in specific genes. However, the brain malformations associated with Dandy-Walker malformation often occur as an isolated feature (not associated with other health problems), and in these cases the cause is frequently unknown. Research suggests that Dandy-Walker malformation could be caused by environmental factors that affect early development before birth. For example, exposure of the fetus to substances that cause birth defects (teratogens) may be involved in the development of this condition. In addition, a mother with diabetes is more likely than a healthy mother to have a child with Dandy-Walker malformation."
"Deafness and myopia syndrome",,https://ghr.nlm.nih.gov/condition/deafness-and-myopia-syndrome,,"Affected individuals have severe nearsightedness (high myopia). These individuals are able to see nearby objects clearly, but objects that are farther away appear blurry. The myopia is usually diagnosed by early childhood.",,,,"SLITRK6 gene mutations that cause deafness and myopia syndrome result in an abnormally short SLITRK6 protein that is not anchored properly to the cell membrane. As a result, the protein is unable to function normally. Impaired SLITRK6 protein function leads to abnormal nerve development in the inner ear and improperly controlled eyeball growth, resulting in the hearing loss and nearsightedness that occur in deafness and myopia syndrome."
"Deafness-dystonia-optic neuronopathy syndrome",,https://ghr.nlm.nih.gov/condition/deafness-dystonia-optic-neuronopathy-syndrome,,"Characterized by impaired vision. Individuals with DDON syndrome have normal vision during childhood, but they may begin to develop an increased sensitivity to light (photophobia) or other vision problems during their teens. These people often have a slowly progressive reduction in the sharpness of vision (visual acuity) and become legally blind in mid-adulthood.",,,,"Most mutations in the TIMM8A gene result in the absence of functional TIMM8A protein inside the mitochondria, which prevents the formation of the TIMM8A/TIMM13 complex. Researchers believe that the lack of this complex leads to abnormal protein transport, although it is unclear how abnormal protein transport affects the function of the mitochondria and causes the signs and symptoms of DDON syndrome."
"Dent disease type 2",,https://ghr.nlm.nih.gov/condition/dent-disease,,cataracts,,,,"Mutations in the CLCN5 or OCRL gene disrupt the reabsorption function of the proximal tubules, which leads to the progressive kidney problems found in people with Dent disease. OCRL gene is active (expressed) throughout the body, it is unclear why Dent disease 2 primarily affects the kidneys and, to a lesser extent, the brain, eyes, and other tissues. The genetic cause of CDA type III has not been identified. It likely results from mutations in a gene located on the long arm of chromosome 15 at a position designated 15q22. Researchers continue to search for the specific gene associated with this form of the condition."
"Diamond-Blackfan anemia",,https://ghr.nlm.nih.gov/condition/diamond-blackfan-anemia,,"Other features of Diamond-Blackfan anemia may include eye problems such as clouding of the lens of the eyes (cataracts), increased pressure in the eyes (glaucoma), or eyes that do not look in the same direction (strabismus). ",,,,"Diamond-Blackfan anemia can be caused by mutations in the RPL5, RPL11, RPL35A, RPS7, RPS10, RPS17, RPS19, RPS24, and RPS26 genes."
"Dilated cardiomyopathy with ataxia syndrome",,https://ghr.nlm.nih.gov/condition/dilated-cardiomyopathy-with-ataxia-syndrome,,"Other common features of DCMA syndrome include degeneration of nerve cells that carry visual information from the eyes to the brain (optic nerve atrophy), which can lead to vision loss.",,,,"The DNAJC19 gene mutations that cause DCMA syndrome lead to the production of an abnormally shortened protein that likely has impaired function. Researchers speculate that a lack of functional DNAJC19 protein alters the transport of other proteins into and out of the mitochondria. When too many or too few proteins move in and out of the mitochondria, energy production and mitochondrial survival can be reduced. Tissues that have high energy demands, such as the heart and the brain, are especially susceptible to decreases in cellular energy production. It is likely that this loss of cellular energy damages these and other tissues, leading to heart problems, movement difficulties, and other features of DCMA syndrome."
"Distal 18q deletion syndrome",,https://ghr.nlm.nih.gov/condition/distal-18q-deletion-syndrome,,"Eye movement disorders and other vision problems disorder. ",,,,"Distal 18q deletion syndrome is caused by a deletion of genetic material from one copy of chromosome 18 anywhere between a region called 18q21 and the end of the chromosome. The size of the deletion varies among affected individuals. The signs and symptoms of distal 18q deletion syndrome are thought to be related to the loss of multiple genes (TCF4, TSHZ1) , some of which have not been identified, from this part of chromosome 18. Researchers are working to determine how the loss of specific genes in this region contributes to the various features of this disorder."
