"Syndroms related to vision impairment",,,,,,,,
Name,,Website,,Problems,,,,Genes
"17β-hydroxysteroid dehydrogenase type 10 deficiency",,https://ghr.nlm.nih.gov/condition/hsd10-disease,,"vision loss ",,,,"HSD17B10 gene mutations cause HSD10 disease reduce the amount of HSD10 protein in cells, impair their structure or function, or both, which leads to a deficiency of the functional complex in which it plays a part. This deficiency impairs the production of mitochondrial tRNAs. Without enough tRNAs, the mitochondrial synthesis of proteins involved in cellular energy production is reduced. A shortage of these proteins results in insufficient energy production in cells of the brain, eyes, and heart, leading to the characteristic features of HSD10 disease."
"19p13.13 deletion syndrome",,https://ghr.nlm.nih.gov/condition/19p1313-deletion-syndrome,,"strabismus and underdevelopment of the optic nerves",,,,"Maybe the loss of the following genes: BEST2, CACNA1, CAL, MAST, and NFI. "
"1p36 deletion syndrome",,https://ghr.nlm.nih.gov/condition/1p36-deletion-syndrome,,"may have vision problem",,,,"1p36 deletion"
"1q21.1 microdeletion",,https://ghr.nlm.nih.gov/condition/1q211-microdeletion,,"Other common signs and symptoms of 1q21.1 microdeletions include eye problems such as clouding of the lenses (cataracts).",,,,"1q21.1 microdeletion are missing a sequence of about 1.35 million DNA building blocks (base pairs), also written as 1.35 megabases (Mb), in the q21.1 region of chromosome 1. However, the exact size of the deleted region varies. "
Abetalipoproteinemia,,https://ghr.nlm.nih.gov/condition/abetalipoproteinemia,,"Individuals with this condition may also develop an eye disorder called retinitis pigmentosa, in which breakdown of the light-sensitive layer (retina) at the back of the eye can cause vision loss. In individuals with abetalipoproteinemia, the retinitis pigmentosa can result in complete vision loss. People with abetalipoproteinemia may also have other eye problems, including involuntary eye movements (nystagmus), eyes that do not look in the same direction (strabismus), and weakness of the external muscles of the eye (ophthalmoplegia).",,,,"MTTP gene mutations lead to the production of microsomal triglyceride transfer protein with reduced or absent function and unable to help in the formation of beta-lipoproteins. A lack of beta-lipoproteins causes severely reduced absorption (malabsorption) of dietary fats and fat-soluble vitamins from the digestive tract into the bloodstream. These nutritional deficiencies lead to health problems in people with abetalipoproteinemia."
Achromatopsia,,https://ghr.nlm.nih.gov/condition/achromatopsia,,"Achromatopsia is a condition characterized by a partial or total absence of color vision. People with complete achromatopsia cannot perceive any colors; they see only black, white, and shades of gray. Incomplete achromatopsia is a milder form of the condition that allows some color discrimination. Achromatopsia also involves other problems with vision, including an increased sensitivity to light and glare (photophobia), involuntary back-and-forth eye movements (nystagmus), and significantly reduced sharpness of vision (low visual acuity). Affected individuals can also have farsightedness (hyperopia) or, less commonly, nearsightedness (myopia). These vision problems develop in the first few months of life.",,,,"Achromatopsia results from changes in one of several genes: CNGA3, CNGB3, GNAT2, PDE6C, or PDE6H. Mutations in any of the genes listed above prevent cones from reacting appropriately to light, which interferes with phototransduction. In people with complete achromatopsia, cones are nonfunctional, and vision depends entirely on the activity of rods. The loss of cone function leads to a total lack of color vision and causes the other vision problems. People with incomplete achromatopsia retain some cone function. These individuals have limited color vision, and their other vision problems tend to be less severe.Some people with achromatopsia do not have identified mutations in any of the known genes. In these individuals, the cause of the disorder is unknown. Other genetic factors that have not been identified likely contribute to this condition."
"ADNP syndrome",,https://ghr.nlm.nih.gov/condition/adnp-syndrome,,"Eye and vision abnormalities, such as eyes that do not point in the same direction (strabismus) and farsightedness (hyperopia), also occur in ADNP syndrome.",,,,"Mutations in the ADNP gene"
"Age-related macular degeneration",,https://ghr.nlm.nih.gov/condition/age-related-macular-degeneration,,"A leading cause of vision loss in older people in developed countries. The vision loss usually becomes noticeable in a person's sixties or seventies and tends to worsen over time. Researchers have described two major types of age-related macular degeneration, known as the dry form and the wet form. The dry form is much more common, accounting for 85 to 90 percent of all cases of age-related macular degeneration. It is characterized by a buildup of yellowish deposits called drusen beneath the retina and vision loss that worsens slowly over time. The condition typically affects vision in both eyes, although vision loss often occurs in one eye before the other. The wet form of age-related macular degeneration is associated with severe vision loss that can worsen rapidly. This form of the condition is characterized by the growth of abnormal, fragile blood vessels underneath the macula. These vessels leak blood and fluid, which damages the macula and makes central vision appear blurry and distorted. ",,,,"Researchers have considered changes in many genes (ABCA4, APOE, ARMS2, ASPM,  BEST1, C2, C3, C9, CETP, CFB, CFH, CFHR1, CFHR2, CFHR3, CFHR4, CFHR5, CF1, COL8A , COL10A1, CST3, CX3CR, ELOVL,  ERCC6, F13B, FBLN5, FILIP1L, FRK, HMCN1, HTRA1, LIPC, MAP2, TIMP3, TNFRSF10A, and VEGFA) as possible risk factors for age-related macular degeneration. "
"Aicardi syndrome",,https://ghr.nlm.nih.gov/condition/aicardi-syndrome,,"Affected individuals also have chorioretinal lacunae, which are defects in the light-sensitive tissue at the back of the eye (retina).In addition to chorioretinal lacunae, people with Aicardi syndrome may have other eye abnormalities such as small or poorly developed eyes (microphthalmia) or a gap or hole (coloboma) in the optic nerve, a structure that carries information from the eye to the brain. These eye abnormalities may cause blindness in affected individuals.",,,,"The cause of Aicardi syndrome is unknown. Because it occurs almost exclusively in females, researchers believe that it is probably the result of a mutation in a gene on the X chromosome. "
"Aicardi-Goutières syndrome",,https://ghr.nlm.nih.gov/condition/aicardi-goutieres-syndrome,,"vision problems",,,,"Mutations in several genes can cause Aicardi-Goutières syndrome. (ADA, IFIH1,  RNASEH2A, RNASEH2B, RNASEH2C, SAMHD1 , TREX1"
"ALG1-congenital disorder of glycosylation",,https://ghr.nlm.nih.gov/condition/alg1-congenital-disorder-of-glycosylation,,"Eye problems that may occur in people with this condition include eyes that do not point in the same direction (strabismus) or involuntary eye movements (nystagmus). Rarely, affected individuals develop vision loss.",,,,"ALG1 gene mutations lead to the production of an abnormal enzyme with reduced activity. The poorly functioning enzyme cannot add mannose to sugar chains efficiently, and the resulting oligosaccharides are often incomplete. Although the short oligosaccharides can be transferred to proteins and fats, the process is not as efficient as with the full-length oligosaccharide. The wide variety of signs and symptoms in ALG1-CDG are likely due to impaired glycosylation of proteins and lipids that are needed for normal function of many organs and tissues."
"ALG6-congenital disorder of glycosylation",,https://ghr.nlm.nih.gov/condition/alg6-congenital-disorder-of-glycosylation,,"Some individuals with ALG6-CDG have eye abnormalities including eyes that do not look in the same direction (strabismus) and an eye disorder called retinitis pigmentosa, which causes vision loss. ",,,,"ALG6 gene mutations lead to the production of an abnormal enzyme with reduced or no activity. Without a properly functioning enzyme, glycosylation cannot proceed normally, and oligosaccharides are incomplete. As a result, glycosylation is reduced or absent. The wide variety of signs and symptoms in ALG6-CDG are likely due to impaired glycosylation of proteins and fats that are needed for normal function in many organs and tissues, including the brain, eyes, liver, and hormone-producing (endocrine) system."
Alpha-mannosidosis,,https://ghr.nlm.nih.gov/condition/alpha-mannosidosis,,"Affected individuals may also experience a clouding of the lens of the eye (cataract).",,,,"Mutations in the MAN2B1 gene interfere with the ability of the alpha-mannosidase enzyme to perform its role in breaking down mannose-containing oligosaccharides. These oligosaccharides accumulate in the lysosomes and cause cells to malfunction and eventually die. Tissues and organs are damaged by the abnormal accumulation of oligosaccharides and the resulting cell death, leading to the characteristic features of alpha-mannosidosis."
"Alpha-methylacyl-CoA racemase deficiency",,https://ghr.nlm.nih.gov/condition/alpha-methylacyl-coa-racemase-deficiency,,"Vision problems caused by deterioration of the light-sensitive layer at the back of the eye (the retina) can also occur in this disorder.",,,,"Most individuals with AMACR deficiency have an AMACR gene mutation that results in a lack (deficiency) of functional enzyme. The enzyme deficiency leads to accumulation of pristanic acid in the blood. However, it is unclear how this accumulation is related to the specific signs and symptoms of AMACR deficiency."
"Alport syndrome",,https://ghr.nlm.nih.gov/condition/alport-syndrome,,"Affected individuals may also have misshapen lenses in the eyes (anterior lenticonus) and abnormal coloration of the light-sensitive tissue at the back of the eye (retina).",,,,"Mutations in the COL4A3, COL4A4, and COL4A5 genes. These genes each provide instructions for making one component of a protein called type IV collagen.  In the eye, this protein is important for maintaining the shape of the lens and the normal color of the retina. Mutations that disrupt type IV collagen can result in misshapen lenses and an abnormally colored retina."
"Alström syndrome",,https://ghr.nlm.nih.gov/condition/alstrom-syndrome,,"progressive loss of vision begin in infancy or early childhood",,,,"Mutations in the ALMS1 gene"
Aniridia,,https://ghr.nlm.nih.gov/condition/aniridia,,"Complete or partial absence of the colored part of the eye (the iris). These iris abnormalities may cause the pupils to be abnormal or misshapen. Aniridia can cause reduction in the sharpness of vision (visual acuity) and increased sensitivity to light (photophobia). can also have other eye problems. Increased pressure in the eye (glaucoma) typically appears in late childhood or early adolescence. Clouding of the lens of the eye (cataracts), occur in 50 percent to 85 percent of people with aniridia. In about 10 percent of affected people, the structures that carry information from the eyes to the brain (optic nerves) are underdeveloped. Individuals with aniridia may also have involuntary eye movements (nystagmus) or underdevelopment of the region at the back of the eye responsible for sharp central vision (foveal hypoplasia). Many of these eye problems contribute to progressive vision loss in affected individuals. The severity of symptoms is typically the same in both eyes.",,,,"Mutations in the PAX6 gene result in the production of a nonfunctional PAX6 protein that is unable to bind to DNA and regulate the activity of other genes. A lack of functional PAX6 protein disrupts the formation of the eyes during embryonic development."
"Ankylosing spondylitis",,https://ghr.nlm.nih.gov/condition/ankylosing-spondylitis,,"Ankylosing spondylitis affects the eyes in up to 40 percent of cases, leading to episodes of eye inflammation called acute iritis. Acute iritis causes eye pain and increased sensitivity to light (photophobia). ",,,,"A variation of the HLA-B gene called HLA-B27 increases the risk of developing ankylosing spondylitis. Although many people with ankylosing spondylitis have the HLA-B27 variation, most people with this version of the HLA-B gene never develop the disorder. It is not known how HLA-B27 increases the risk of developing ankylosing spondylitis. Variations in several additional genes, including ERAP1, IL1A, and IL23R, have also been associated with ankylosing spondylitis. Although these genes play critical roles in the immune system, it is unclear how variations in these genes affect a person's risk of developing ankylosing spondylitis. Changes in genes that have not yet been identified are also believed to affect the chances of developing ankylosing spondylitis and influence the progression of the disorder. Some of these genes likely play a role in the immune system, while others may have different functions. Researchers are working to identify these genes and clarify their role in ankylosing spondylitis."
"Apert syndrome",,https://ghr.nlm.nih.gov/condition/apert-syndrome,,"Shallow eye sockets can cause vision problems.",,,,"Mutations in the FGFR2"
"Arts syndrome",,https://ghr.nlm.nih.gov/condition/arts-syndrome#genes,,"In early childhood, affected boys develop vision loss caused by degeneration of nerves that carry information from the eyes to the brain (optic nerve atrophy). ",,,,"Mutations in the PRPS1 gene cause Arts syndrome."
"Asphyxiating thoracic dystrophy",,https://ghr.nlm.nih.gov/condition/asphyxiating-thoracic-dystrophy,,"Less common features includes an eye disease called retinal dystrophy that can lead to vision loss.",,,,"Mutations in at least 11 genes (CEP12 , CSPP1, DYNC2H1, IFT8 , IFT140, IFT17, TTC21, WDR19, WDR34, WDR35, WDR60) have been found to cause asphyxiating thoracic dystrophy. Genetic changes in the IFT80 gene were the first to be associated with this condition. Later, researchers discovered that mutations in another gene, DYNC2H1, account for up to half of all cases. Mutations in other genes each cause a small percentage of cases. In total, about 70 percent of people with asphyxiating thoracic dystrophy have mutations in one of the known genes."
"Ataxia neuropathy spectrum",,https://ghr.nlm.nih.gov/condition/ataxia-neuropathy-spectrum,,"Other signs and symptoms can include blindness.",,,,"Ataxia neuropathy spectrum is caused by mutations in the POLG gene or, rarely, the TWNK gene."
"Ataxia with oculomotor apraxia",,https://ghr.nlm.nih.gov/condition/ataxia-with-oculomotor-apraxia,,"Most affected people also have oculomotor apraxia, which makes it difficult to move their eyes side-to-side. People with oculomotor apraxia have to turn their head to see things in their side (peripheral) vision.",,,,"Mutations in the APTX and SETX genes cause ataxia with oculomotor apraxia types 1 and 2, respectively. Mutations in other genes (PIK3R, PNKP) re responsible for the rare types of ataxia with oculomotor apraxia."
"Ataxia with vitamin E deficiency",,https://ghr.nlm.nih.gov/condition/ataxia-with-vitamin-e-deficiency,,"Some people with this condition have developed an eye disorder called retinitis pigmentosa that causes vision loss. ",,,,"TTPA gene mutations impair the activity of the αTTP protein, resulting in an inability to retain and use dietary vitamin E."
"Autosomal dominant cerebellar ataxia, deafness, and narcolepsy",,https://ghr.nlm.nih.gov/condition/autosomal-dominant-cerebellar-ataxia-deafness-and-narcolepsy,,"Other features that can occur as the condition worsens include degeneration of the nerves that carry information from the eyes to the brain (optic atrophy); clouding of the lenses of the eyes (cataracts);",,,,"DNMT1 gene mutations that cause ADCADN affect a region of the DNA methyltransferase 1 enzyme that helps target the methylation process to the correct segments of DNA. As a result of these mutations, methylation is abnormal, which affects the expression of multiple genes. Maintenance of the neurons that make up the nervous system is disrupted, leading to the signs and symptoms of ADCADN."
"Autosomal dominant congenital stationary night blindness",,https://ghr.nlm.nih.gov/condition/autosomal-dominant-congenital-stationary-night-blindness,,"night blindness",,"Congenital disorder of retina",,"Mutations in the RHO, GNAT1, or PDE6B gene disrupt the normal signaling that occurs within rod cells. As a result, the rods cannot effectively transmit signals to the brain, leading to a lack of visual perception in low light."
"Autosomal dominant vitreoretinochoroidopathy",,https://ghr.nlm.nih.gov/condition/autosomal-dominant-vitreoretinochoroidopathy,,"mild reduction to complete loss of vision due to glaucoma or cataracts. A characteristic feature of ADVIRC, visible with a special eye exam, is a circular band of excess coloring (hyperpigmentation) in the retina. This feature can help physicians diagnose the disorder. Affected individuals may also have white spots on the retina.",,"defects in the retinal pigment epithelium or the photoreceptors causing microcornea and shallow anterior chamber",,"mutations in the BEST1 gene which plays a critical role in normal vision"
"Autosomal recessive congenital stationary night blindness",,https://ghr.nlm.nih.gov/condition/autosomal-recessive-congenital-stationary-night-blindness,,"A disorder of the retina. People with this condition typically have difficulty seeing and distinguishing objects in low light (night blindness). For example, they may not be able to identify road signs at night or see stars in the night sky. They also often have other vision problems, including loss of sharpness (reduced acuity), nearsightedness (myopia), involuntary movements of the eyes (nystagmus), and eyes that do not look in the same direction (strabismus). The vision problems associated with this condition are congenital, which means they are present from birth. They tend to remain stable (stationary) over time.",,,,"Mutations in several genes (CABP4, GPR179, GRM6, LRIT3, SLC24A1, TRPM) can cause autosomal recessive congenital stationary night blindness. Each of these genes provide instructions for making proteins that are found in the retina. These proteins are involved in sending (transmitting) visual signals from cells called rods, which are specialized for vision in low light, to cells called bipolar cells, which relay the signals to other retinal cells. This signaling is an essential step in the transmission of visual information from the eyes to the brain.Mutations in two genes, GRM6 and TRPM1, cause most cases of this condition. These genes provide instructions for making proteins that are necessary for bipolar cells to receive and relay signals. Mutations in other genes involved in the same bipolar cell signaling pathway are likely responsible for a small percentage of cases of autosomal recessive congenital stationary night blindness."
"Autosomal recessive spastic ataxia of Charlevoix-Saguenay",,https://ghr.nlm.nih.gov/condition/autosomal-recessive-spastic-ataxia-of-charlevoix-saguenay,,"People with ARSACS typically have involuntary eye movements (nystagmus). Other problems may include yellow streaks of fatty tissue in the light-sensitive tissue at the back of the eye (hypermyelination of the retina).",,,,"Mutations in the SACS gene cause the production of an unstable sacsin protein that does not function normally. It is unclear how the abnormal sacsin protein affects the brain and skeletal muscles and results in the signs and symptoms of ARSACS."
"Axenfeld-Rieger syndrome",,https://ghr.nlm.nih.gov/condition/axenfeld-rieger-syndrome,,"the colored part of the eye (the iris), may be thin or poorly developed. often have a pupil that is off-center (corectopia) or extra holes in the iris that can look like multiple pupils (polycoria). This condition can also cause abnormalities of the cornea, About half of affected individuals develop glaucoma",,,,"Axenfeld-Rieger syndrome results from mutations in at least two known genes, PITX2 and FOXC1. PITX2 gene mutations cause type 1, and FOXC1 gene mutations cause type 3. The gene associated with type 2 is likely located on chromosome 13, but it has not been identified. Mutations in either the PITX2 or FOXC1 gene disrupt the activity of other genes that are needed for normal development. Impaired regulation of these genes leads to problems in the formation of the anterior segment of the eye "
"Bardet-Biedl syndrome",,https://ghr.nlm.nih.gov/condition/bardet-biedl-syndrome,,"Vision loss is one of the major features of Bardet-Biedl syndrome. Loss of vision occurs as the light-sensing tissue at the back of the eye (the retina) gradually deteriorates. Problems with night vision become apparent by mid-childhood, followed by blind spots that develop in the side (peripheral) vision. Over time, these blind spots enlarge and merge to produce tunnel vision. Most people with Bardet-Biedl syndrome also develop blurred central vision (poor visual acuity) and become legally blind by adolescence or early adulthood.",,,,"Bardet-Biedl syndrome can result from mutations in at least 14 different genes (often called BBS genes, ARL6, BBS1, BBS2, BBS4, BBS5, BBS7, BBS9, BBS10, BBS12, CEP290, MKKS, MKS1, TRIM32, TTC8). Mutations in BBS genes lead to problems with the structure and function of cilia. About one-quarter of all cases of Bardet-Biedl syndrome result from mutations in the BBS1 gene. Another 20 percent of cases are caused by mutations in the BBS10 gene. The other BBS genes each account for only a small percentage of all cases of this condition. In about 25 percent of people with Bardet-Biedl syndrome, the cause of the disorder is unknown."
"Behçet disease",,https://ghr.nlm.nih.gov/condition/behcet-disease,,"An inflammation of the eye called uveitis is found in more than half of people with Behçet disease. Eye problems are more common in younger people with the disease and affect men more often than women. Uveitis can result in blurry vision and an extreme sensitivity to light (photophobia). Rarely, inflammation can also cause eye pain and redness. If untreated, the eye problems associated with Behçet disease can lead to blindness.",,,,"a particular variation in the HLA-B gene has been associated with the risk of developing Behçet disease."
"Benign essential blepharospasm",,https://ghr.nlm.nih.gov/condition/benign-essential-blepharospasm,,"Abnormal blinking or spasms of the eyelids. As the condition progresses, spasms of the muscles surrounding the eyes cause involuntary winking or squinting. Affected individuals have increasing difficulty keeping their eyes open, which can lead to severe vision impairment. ",,,,"Although genetic factors are almost certainly involved in benign essential blepharospasm, no genes have been clearly associated with the condition. Several studies have looked at the relationship between common variations (polymorphisms) in the DRD5 and TOR1A genes and the risk of developing benign essential blepharospasm. These studies have had conflicting results, with some showing an association and others finding no connection. "
"Beta-ureidopropionase deficiency",,https://ghr.nlm.nih.gov/condition/beta-ureidopropionase-deficiency,,"Deterioration of the optic nerve, which carries visual information from the eyes to the brain, can lead to vision loss in this condition.",,,,"UPB1 gene mutations can reduce or eliminate beta-ureidopropionase enzyme activity. Loss of this enzyme function reduces the production of beta-aminoisobutyric acid and beta-alanine, and leads to an excess of their precursor molecules, N-carbamyl-beta-aminoisobutyric acid and N-carbamyl-beta-alanine, which are released in the urine. Reduced production of beta-aminoisobutyric acid and beta-alanine may impair the function of these molecules in the nervous system, leading to neurological problems in some people with beta-ureidopropionase deficiency. The extent of the reduction in enzyme activity caused by a particular UPB1 gene mutation, "
"Bietti crystalline dystrophy",,https://ghr.nlm.nih.gov/condition/bietti-crystalline-dystrophy,,"progressive vision loss. People with Bietti crystalline dystrophy typically begin noticing vision problems in their teens or twenties. They experience a loss of sharp vision (reduction in visual acuity) and difficulty seeing in dim light (night blindness). They usually lose areas of vision (visual field loss), most often side (peripheral) vision. Color vision may also be impaired.",,"small, yellow or white crystal-like deposits of fatty (lipid) compounds accumulate in the light-sensitive tissue that lines the back of the eye (the retina). ",,"CYP4V2 gene mutations that cause Bietti crystalline dystrophy impair or eliminate the function of this enzyme and are believed to affect lipid breakdown. However, it is unknown how they lead to the specific signs and symptoms of Bietti crystalline dystrophy. For unknown reasons, the severity of the signs and symptoms differs significantly among individuals with the same CYP4V2 gene mutation"
