"Gillespie syndrome",,https://ghr.nlm.nih.gov/condition/gillespie-syndrome,,"A disorder that involves eye abnormalities. Gillespie syndrome is characterized by aniridia, which is the absence of the colored part of the eye (the iris). In most affected individuals, only part of the iris is missing (partial aniridia) in both eyes, but in some affected individuals, partial aniridia affects only one eye, or the entire iris is missing (complete aniridia) in one or both eyes. The absence of all or part of the iris can cause blurry vision (reduced visual acuity) and increased sensitivity to light (photophobia). Rapid, involuntary eye movements (nystagmus) can also occur in Gillespie syndrome.",,,,"Mutations in the PAX6 gene result in the absence of the PAX6 protein or production of a nonfunctional PAX6 protein that is unable to bind to DNA and regulate the activity of other genes. This lack of functional protein disrupts embryonic development, especially the development of the eyes and brain, leading to the signs and symptoms of Gillespie syndrome. Most people with Gillespie syndrome do not have mutations in the PAX6 gene. In these affected individuals, the cause of the disorder is unknown."
"GM1 gangliosidosis",,https://ghr.nlm.nih.gov/condition/gm1-gangliosidosis,,"Clouding of the clear outer covering of the eye (the cornea). Loss of vision occurs as the light-sensing tissue at the back of the eye (the retina) gradually deteriorates. An eye abnormality called a cherry-red spot, which can be identified with an eye examination, is characteristic of this disorder.",,,,"Mutations in the GLB1 gene reduce or eliminate the activity of β-galactosidase. Without enough functional β-galactosidase, GM1 ganglioside cannot be broken down when it is no longer needed. As a result, this substance accumulates to toxic levels in many tissues and organs, particularly in the brain. Progressive damage caused by the buildup of GM1 ganglioside leads to the destruction of nerve cells in the brain, causing many of the signs and symptoms of GM1 gangliosidosis. In general, the severity of GM1 gangliosidosis is related to the level of β-galactosidase activity. Individuals with higher enzyme activity levels usually have milder signs and symptoms than those with lower activity levels because they have less accumulation of GM1 ganglioside within the body."
"GM2-gangliosidosis, AB variant",,https://ghr.nlm.nih.gov/condition/gm2-gangliosidosis-ab-variant,,"As the disease progresses, children with the AB variant experience vision loss, intellectual disability, and paralysis. An eye abnormality called a cherry-red spot, which can be identified with an eye examination, is characteristic of this disorder. ",,,,"Mutations in the GM2A gene disrupt the activity of the GM2 ganglioside activator, which prevents beta-hexosaminidase A from breaking down GM2 ganglioside. As a result, this substance accumulates to toxic levels, particularly in neurons in the brain and spinal cord. Progressive damage caused by the buildup of GM2 ganglioside leads to the destruction of these neurons, which causes the signs and symptoms of the AB variant."
"GM3 synthase deficiency",,https://ghr.nlm.nih.gov/condition/gm3-synthase-deficiency,,"Although affected infants can likely see and hear at birth, vision and hearing become impaired as the disease worsens. ",,,,"ST3GAL5 gene mutations prevent the production of any functional GM3 synthase. Without this enzyme, cells cannot produce gangliosides normally. It is unclear how a loss of this enzyme leads to the signs and symptoms of GM3 synthase deficiency. "
"Graves disease",,https://ghr.nlm.nih.gov/condition/graves-disease,,"Between 25 and 50 percent of people with Graves disease have eye abnormalities, which are known as Graves ophthalmopathy. These eye problems can include swelling and inflammation, redness, dryness, puffy eyelids, and a gritty sensation like having sand or dirt in the eyes. Some people develop bulging of the eyes caused by inflammation of tissues behind the eyeball and ""pulling back"" (retraction) of the eyelids. Rarely, affected individuals have more serious eye problems, such as pain, double vision, and pinching (compression) of the optic nerve connecting the eye and the brain, which can cause vision loss.",,,,"Variations in many genes have been studied as possible risk factors for Graves disease. Some of these genes (CD40, CTLA4, HLA-DRB1, IL2RA, PTPN22, SCGB3A2, TG, TSHR are part of a family called the human leukocyte antigen (HLA) complex. The HLA complex helps the immune system distinguish the body's own proteins from proteins made by foreign invaders (such as viruses and bacteria). Other genes that have been associated with Graves disease help regulate the immune system or are involved in normal thyroid function. Most of the genetic variations that have been discovered are thought to have a small impact on a person's overall risk of developing this condition."
"Griscelli syndrome type 1",,https://ghr.nlm.nih.gov/condition/griscelli-syndrome,,"Griscelli syndrome type 1 involves severe problems with brain function in addition to the.... Affected individuals typically have eye and vision abnormalities",,,,"The three types of Griscelli syndrome are caused by mutations in different genes: Type 1 results from mutations in the MYO5A gene, type 2 is caused by mutations in the RAB27A gene, and type 3 results from mutations in the MLPH gene."
"Gyrate atrophy of the choroid and retina",,https://ghr.nlm.nih.gov/condition/gyrate-atrophy-of-the-choroid-and-retina,,"Ongoing loss of cells (atrophy) in the retina, which is the specialized light-sensitive tissue that lines the back of the eye, and in a nearby tissue layer called the choroid. During childhood, they begin experiencing nearsightedness (myopia), difficulty seeing in low light (night blindness), and loss of side (peripheral) vision. Over time, their field of vision continues to narrow, resulting in tunnel vision. Many people with gyrate atrophy also develop clouding of the lens of the eyes (cataracts). These progressive vision changes lead to blindness by about the age of 50.",,,,"Mutations in the OAT gene"
"Hajdu-Cheney syndrome",,https://ghr.nlm.nih.gov/condition/hajdu-cheney-syndrome,,"The most serious complications of Hajdu-Cheney syndrome, which occur in about half of all affected individuals, are abnormalities known as platybasia and basilar invagination. These abnormalities can lead to severe neurological problems, including abnormal vision ",,,,"Mutations in a specific area near the end of the NOTCH2 gene are associated with Hajdu-Cheney syndrome. These mutations lead to a version of the Notch2 receptor that cannot be broken down normally. As a result, the receptor continues to be active even after signaling should stop. Researchers are unsure how excessive Notch2 signaling is related to the varied features of Hajdu-Cheney syndrome."
"Hereditary angiopathy with nephropathy, aneurysms, and muscle cramps syndrome",,https://ghr.nlm.nih.gov/condition/hereditary-angiopathy-with-nephropathy-aneurys,,"Individuals with HANAC syndrome also experience a variety of eye problems. All individuals with this condition have arteries that twist and turn abnormally within the light-sensitive tissue at the back of the eyes (arterial retinal tortuosity). This blood vessel abnormality can cause episodes of bleeding within the eyes following any minor trauma to the eyes, leading to temporary vision loss. Other eye problems associated with HANAC syndrome include a clouding of the lens of the eye (cataract) and an abnormality called Axenfeld-Rieger anomaly. Axenfeld-Rieger anomaly is associated with various other eye abnormalities, including underdevelopment and eventual tearing of the colored part of the eye (iris), and a pupil that is not in the center of the eye.",,,,"The COL4A1 gene mutations that cause HANAC syndrome result in the production of a protein that disrupts the structure of type IV collagen. As a result, type IV collagen molecules cannot attach to each other to form the protein networks in basement membranes. Basement membranes without these networks are unstable, leading to weakening of the tissues that they surround. In people with HANAC syndrome, the vasculature and other tissues within the kidneys, brain, muscles, eyes, and throughout the body weaken."
"Hereditary cerebral amyloid angiopathy",,https://ghr.nlm.nih.gov/condition/hereditary-cerebral-amyloid-angiopathy,,"Two types of hereditary cerebral amyloid angiopathy, known as familial British dementia and familial Danish dementia, are characterized by dementia and movement problems.  People with the Danish type may also have clouding of the lens of the eyes (cataracts) or deafness.",,,,"Mutations in the APP gene are the most common cause of hereditary cerebral amyloid angiopathy. APP gene mutations cause the Dutch, Italian, Arctic, Iowa, Flemish, and Piedmont types of this condition. Mutations in the CST3 gene cause the Icelandic type. Familial British and Danish dementia are caused by mutations in the ITM2B gene."
"Hermansky-Pudlak syndrome",,https://ghr.nlm.nih.gov/condition/hermansky-pudlak-syndrome,,"Abnormally light coloring (pigmentation) of the eyes. Oculocutaneous albinism reduces pigmentation of the colored part of the eye (iris) and the light-sensitive tissue at the back of the eye (retina). Reduced vision, rapid and involuntary eye movements (nystagmus), and increased sensitivity to light (photophobia) are also common in oculocutaneous albinism",,,,"Mutations in the genes (AP3B1, BLOC1S3, BLOC1S6, DTNBP1, HPS1, HPS3, HPS4, HPS5, HPS6) associated with Hermansky-Pudlak syndrome prevent the formation of LROs or impair the functioning of these cell structures. In general, mutations in genes that involve the same protein complex cause similar signs and symptoms. People with this syndrome have oculocutaneous albinism because the LROs within melanocytes cannot produce and distribute the substance that gives skin, hair, and eyes their color (melanin). Mutations in the HPS1 gene cause approximately 75 percent of the Hermansky-Pudlak syndrome cases from Puerto Rico. About 45 percent of affected individuals from other populations have mutations in the HPS1 gene. Mutations in the HPS3 gene are found in about 25 percent of affected people from Puerto Rico and in approximately 20 percent of affected individuals from other areas. The other genes associated with Hermansky-Pudlak syndrome each account for a small percentage of cases of this condition."
Homocystinuria,,https://ghr.nlm.nih.gov/condition/homocystinuria,,"The most common form of homocystinuria is characterized by nearsightedness (myopia), dislocation of the lens at the front of the eye,",,,,"Mutations in the CBS, MTHFR, MTR, MTRR, and MMADHC genes cause homocystinuria.Mutations in the CBS gene cause the most common form of homocystinuria. Rarely, homocystinuria can be caused by mutations in several other genes. The enzymes made by the MTHFR, MTR, MTRR, and MMADHC genes play roles in converting homocysteine to methionine. Mutations in any of these genes prevent the enzymes from functioning properly, which leads to a buildup of homocysteine in the body."
"Horizontal gaze palsy with progressive scoliosis",,https://ghr.nlm.nih.gov/condition/horizontal-gaze-palsy-with-progressive-scoliosis#genes,,"A disorder that affects vision and also causes an abnormal curvature of the spine (scoliosis). People with this condition are unable to move their eyes side-to-side (horizontally). As a result, affected individuals must turn their head instead of moving their eyes to track moving objects. Up-and-down (vertical) eye movements are typically normal. It tends to be moderate to severe and worsens over time.",,,,"Mutations in the ROBO3 gene. The ROBO3 protein plays a critical role in ensuring that motor and sensory nerve pathways cross over in the brainstem. In people with HGPPS, these pathways do not cross over, but stay on the same side of the body. Researchers believe that this miswiring in the brainstem is the underlying cause of the eye movement abnormalities associated with the disorder. The cause of progressive scoliosis in HGPPS is unclear. Researchers are working to determine why the effects of ROBO3 mutations appear to be limited to horizontal eye movement and scoliosis."
"Hyperferritinemia-cataract syndrome",,https://ghr.nlm.nih.gov/condition/hyperferritinemia-cataract-syndrome,,"An excess of an iron storage protein called ferritin in the blood (hyperferritinemia) and tissues of the body. A buildup of this protein begins early in life, leading to clouding of the lenses of the eyes (cataracts). In affected individuals, cataracts usually develop in infancy, rather than after age 60 as typically occurs in the general population. Cataracts that are not removed surgically cause progressive dimming and blurriness of vision because the clouded lenses reduce and distort incoming light.",,,,"Mutations that cause hyperferritinemia-cataract syndrome are found in a segment of the FTL gene called the iron responsive element (IRE). The IRE normally can attach (bind) to a protein called the iron regulatory protein (IRP). When this binding occurs, the activity (expression) of the FTL gene is stopped to prevent too much ferritin light chain from being produced. This normally occurs when iron levels are low, because under those circumstances less ferritin is needed to store the iron. Mutations in the IRE segment of the FTL gene prevent it from binding with IRP, interfering with the mechanism by which ferritin production is matched to iron levels and resulting in excess ferritin being formed."
"Hypomyelination and congenital cataract",,https://ghr.nlm.nih.gov/condition/hypomyelination-and-congenital-cataract,,"Additionally, people with this disorder are typically born with a clouding of the lens (cataract) in both eyes.",,,,"Mutations in the FAM126A gene cause hypomyelination and congenital cataract."
"Incontinentia pigmenti",,https://ghr.nlm.nih.gov/condition/incontinentia-pigmenti#genes,,"Other signs and symptoms of incontinentia pigmenti can include hair loss (alopecia) affecting the scalp and other parts of the body, dental abnormalities (such as small teeth or few teeth), eye abnormalities that can lead to vision loss, ",,,,"About 80 percent of affected individuals have a mutation that deletes some genetic material from the IKBKG gene. This deletion probably leads to the production of an abnormally small, nonfunctional version of the IKBKG protein. Other people with incontinentia pigmenti have mutations that prevent the production of any IKBKG protein. Without this protein, nuclear factor-kappa-B is not regulated properly, and cells are more sensitive to signals that trigger them to self-destruct. Researchers believe that this abnormal cell death leads to the signs and symptoms of incontinentia pigmenti."
"Infantile neuroaxonal dystrophy",,,,"Rapid, involuntary eye movements (nystagmus), eyes that do not look in the same direction (strabismus), and vision loss due to deterioration (atrophy) of the nerve that carries information from the eye to the brain (the optic nerve) often occur",,,,"Mutations in the PLA2G6 gene impair the function of the PLA2 group VI enzyme, which may disrupt cell membrane maintenance and contribute to the development of spheroid bodies in the nerve axons. Although it is unknown how changes in this enzyme's function lead to the signs and symptoms of infantile neuroaxonal dystrophy, phospholipid metabolism problems have been seen in both this disorder and a similar disorder called pantothenate kinase-associated neurodegeneration. These disorders, as well as the more common Alzheimer disease and Parkinson disease, also are associated with changes in brain iron metabolism. Researchers are studying the links between phospholipid defects, brain iron, and damage to nerve cells, but have not determined how the iron accumulation that occurs in some individuals with infantile neuroaxonal dystrophy may contribute to the features of this disorder."
"Infantile-onset spinocerebellar ataxia",,https://ghr.nlm.nih.gov/condition/infantile-onset-spinocerebellar-ataxia,,"IOSCA also leads to vision and hearing problems that begin by about age 7. Children with this disorder develop weakness in the muscles that control eye movement (ophthalmoplegia). In their teenage years they experience degeneration of the nerves that carry information from the eyes to the brain (optic atrophy), which can result in vision loss. ",,,,"The TWNK gene mutations that cause IOSCA interfere with the function of the Twinkle protein and result in reduced quantities of mtDNA (mtDNA depletion). Impaired mitochondrial function in the nervous system, muscles, and other tissues that require a large amount of energy leads to neurological dysfunction and the other problems associated with IOSCA."
"Isolated Duane retraction syndrome",,https://ghr.nlm.nih.gov/condition/isolated-duane-retraction-syndrome,,"A disorder of eye movement. This condition prevents outward movement of the eye (toward the ear), and in some cases may also limit inward eye movement (toward the nose). As the eye moves inward, the eyelids partially close and the eyeball pulls back (retracts) into its socket. Most commonly, only one eye is affected. About 10 percent of people with isolated Duane retraction syndrome develop amblyopia (""lazy eye""), a condition that causes vision loss in the affected eye.",,,,"In most people with isolated Duane retraction syndrome, the cause of the condition is unknown. However, researchers have identified mutations in one gene, CHN1, that cause the disorder in a small number of families. The CHN1 gene provides instructions for making a protein that is involved in the early development of the nervous system. Specifically, the protein appears to be critical for the formation of nerves that control several of the muscles surrounding the eyes (extraocular muscles). Mutations in the CHN1 gene disrupt the normal development of these nerves and the extraocular muscles needed for side-to-side eye movement. Abnormal function of these muscles leads to restricted eye movement and related problems with vision."
"Isolated ectopia lentis",,https://ghr.nlm.nih.gov/condition/isolated-ectopia-lentis,,"The lens in one or both eyes is not centrally positioned as it should be but is off-center (displaced). Affected individuals often have nearsightedness (myopia) and can have an irregular curvature of the cornea, which causes blurred vision (astigmatism). They may also develop clouding of the lenses (cataracts) or increased pressure in the eyes (glaucoma) at an earlier age than other adults. In a small number of people with isolated ectopia lentis, retinal detachment occurs, which can lead to further vision problems and possible blindness. Ectopia lentis is a common feature of genetic syndromes such as Marfan syndrome and Weill-Marchesani syndrome.",,"The displaced lens cannot focus light correctly, contributing to the vision problems that are common in people with isolated ectopia lentis.",,"Mutations in the FBN1 or ADAMTSL4 gene impair protein function and lead to a decrease in microfibril formation or result in the formation of impaired microfibrils. Without functional microfibrils to anchor the lens in its central position at the front of the eye, the lens becomes displaced. The displaced lens cannot focus light correctly, contributing to the vision problems that are common in people with isolated ectopia lentis."
"Joubert syndrome",,https://ghr.nlm.nih.gov/condition/joubert-syndrome,,"Joubert syndrome can include a broad range of additional signs and symptoms. The condition is sometimes associated with other eye abnormalities (such as retinal dystrophy, which can cause vision loss, and coloboma, which is a gap or split in a structure of the eye), ",,,,"Joubert syndrome can be caused by mutations in more than 30 genes (AHI1, ARL13B, B9D1, B9D2, C2CD3, C5orf42, CC2D2A, CEP41, CEP104, CEP120, CEP290, CSPP1, IFT172, INPP5E, KIAA0556, KIAA0586, KIF, MKS, NPHP, OFD1, PDE6D, POC1B, RPGRIP1, TCTN, TCTN, TCTN, TMEM6, TMEM10, TMEM13, TMEM21, TMEM23, TMEM23, TTC21B, ZNF42.) Mutations in the genes associated with Joubert syndrome lead to problems with the structure and function of primary cilia. Defects in these cell structures can disrupt important chemical signaling pathways during development. Although researchers believe that defective primary cilia are responsible for most of the features of these disorders, it is not completely understood how they lead to specific developmental abnormalities. Mutations in the genes known to be associated with Joubert syndrome account for about 60 to 90 percent of all cases of this condition. In the remaining cases, the genetic cause is unknown."
"Kaufman oculocerebrofacial syndrome",,https://ghr.nlm.nih.gov/condition/kaufman-oculocerebrofacial-syndrome,,"Eye abnormalities and their effect on vision vary among people with Kaufman oculocerebrofacial syndrome. Some people with this disorder have abnormally small or poorly developed eyes (microphthalmia); microcornea, in which the clear front covering of the eye (cornea) is small and abnormally curved; missing pieces of tissue in structures that form the eye (coloboma); or underdevelopment of the nerves that carry signals between the eyes and the brain (optic nerve hypoplasia). Eyes that do not look in the same direction (strabismus), nearsightedness (myopia) or farsightedness (hyperopia), or an inward turning of the lower eyelid (entropion) can also occur.",,,,"Kaufman oculocerebrofacial syndrome is caused by mutations in the UBE3B gene. The UBE3B gene mutations that cause Kaufman oculocerebrofacial syndrome are thought to result in an abnormal UBE3B protein that cannot function properly or that is unstable and is rapidly broken down. Loss of this protein's function likely prevents cells from eliminating certain unnecessary proteins, resulting in problems with development and function of the brain, eyes, and other parts of the body."
"Kearns-Sayre syndrome",,https://ghr.nlm.nih.gov/condition/kearns-sayre-syndrome,,"A condition that affects many parts of the body, especially the eyes. The features of Kearns-Sayre syndrome usually appear before age 20, and the condition is diagnosed by a few characteristic signs and symptoms. People with Kearns-Sayre syndrome have progressive external ophthalmoplegia, which is weakness or paralysis of the eye muscles that impairs eye movement and causes drooping eyelids (ptosis). Affected individuals also have an eye condition called pigmentary retinopathy, which results from breakdown (degeneration) of the light-sensing tissue at the back of the eye (the retina) that gives it a speckled and streaked appearance. The retinopathy may cause loss of vision. ",,,,"The mtDNA deletions that cause Kearns-Sayre syndrome result in the loss of genes important for mitochondrial protein formation and oxidative phosphorylation. The most common deletion removes 4,997 nucleotides, which includes twelve mitochondrial genes. Deletions of mtDNA result in impairment of oxidative phosphorylation and a decrease in cellular energy production. Regardless of which genes are deleted, all steps of oxidative phosphorylation are affected. Researchers have not determined how these deletions lead to the specific signs and symptoms of Kearns-Sayre syndrome, although the features of the condition are probably related to a lack of cellular energy. It has been suggested that eyes are commonly affected by mitochondrial defects because they are especially dependent on mitochondria for energy."
"Keratitis-ichthyosis-deafness syndrome",,https://ghr.nlm.nih.gov/condition/keratitis-ichthyosis-deafness-syndrome,,"Characterized by eye problems. People with KID syndrome usually have keratitis, which is inflammation of the front surface of the eye (the cornea). The keratitis may cause pain, increased sensitivity to light (photophobia), abnormal blood vessel growth over the cornea (neovascularization), and scarring. Over time, affected individuals experience a loss of sharp vision (reduced visual acuity); in severe cases the keratitis can lead to blindness.",,,,"The GJB2 gene mutations that cause KID syndrome change single protein building blocks (amino acids) in connexin 26. The mutations are thought to result in channels that constantly leak ions, which impairs the health of the cells and increases cell death. Death of cells in the skin and the inner ear may underlie the ichthyosis and deafness that occur in KID syndrome. It is unclear how GJB2 gene mutations affect the eye."
