"Oculodentodigital dysplasia",,https://ghr.nlm.nih.gov/condition/oculodentodigital-dysplasia,,"Affects many parts of the body, particularly the eyes (oculo-), ",,,,"GJA1 gene mutations result in abnormal connexin43 proteins. Channels formed with abnormal proteins are often permanently closed. Some mutations prevent connexin43 proteins from traveling to the cell surface where they are needed to form channels between cells. Impaired functioning of these channels disrupts cell-to-cell communication, which likely interferes with normal cell growth and cell specialization, processes that determine the shape and function of many different parts of the body. These developmental problems cause the signs and symptoms of oculodentodigital dysplasia."
"Oculofaciocardiodental syndrome",,https://ghr.nlm.nih.gov/condition/oculofaciocardiodental-syndrome,,"Oculofaciocardiodental (OFCD) syndrome is a condition that affects the development of the eyes (oculo-),The eye abnormalities associated with OFCD syndrome can affect one or both eyes. Many people with this condition are born with eyeballs that are abnormally small (microphthalmia). Other eye problems can include clouding of the lens (cataract) and a higher risk of glaucoma, an eye disease that increases the pressure in the eye. These abnormalities can lead to vision loss or blindness.",,,,"Several mutations in the BCOR gene have been found in people with OFCD syndrome. These mutations prevent the production of any functional protein from the altered gene, which disrupts the normal development of the eyes and several other organs and tissues before birth."
"Optic atrophy type 1",,https://ghr.nlm.nih.gov/condition/optic-atrophy-type-1,,"Optic atrophy type 1 is a condition that often causes slowly worsening vision, usually beginning in childhood. People with optic atrophy type 1 typically experience a narrowing of their field of vision (tunnel vision). Affected individuals gradually lose their sight as their field of vision becomes smaller. Both eyes are usually affected equally, but the severity of the vision loss varies widely, even among affected members of the same family, ranging from nearly normal vision to complete blindness. In addition to vision loss, people with optic atrophy type 1 frequently have problems with color vision (color vision deficiency) that make it difficult or impossible to distinguish between shades of blue and green.In the early stages of the condition, individuals with optic atrophy type 1 experience a progressive loss of certain cells within the retina, which is a specialized light-sensitive tissue that lines the back of the eye. The loss of these cells (known as retinal ganglion cells) is followed by the degeneration (atrophy) of the nerves that relay visual information from the eye to the brain (optic nerves), which results in further vision loss. Atrophy causes these nerves to have an abnormally pale appearance (pallor), which can be seen during an eye examination.",,,,"Mutations in the OPA1 gene lead to problems with mitochondrial function. The mitochondria become misshapen and disorganized and have reduced energy-producing capabilities. The maintenance of mtDNA may also be impaired, resulting in mtDNA mutations that further interfere with mitochondrial energy production. Cells that contain these poorly functioning mitochondria are more susceptible to apoptosis. In particular, cells that have high energy demands, such as retinal ganglion cells, die over time. Specialized extensions of retinal ganglion cells, called axons, form the optic nerves, so when retinal ganglion cells die, the optic nerves atrophy and cannot transmit visual information to the brain."
"Oral-facial-digital syndrome",,https://ghr.nlm.nih.gov/condition/oral-facial-digital-syndrome#definition,,"Other forms of oral-facial-digital syndrome are characterized by neurological problems, particular vision loss",,,,"Mutations in the OFD1 gene prevent cells from making enough functional OFD1 protein, which disrupts the normal development of these structures. It is unclear how a shortage of this protein causes the specific features of oral-facial-digital syndrome type I."
"Ornithine translocase deficiency",,https://ghr.nlm.nih.gov/condition/ornithine-translocase-deficiency,,"Ornithine translocase deficiency is an inherited disorder that causes ammonia to accumulate in the blood. This rapid increase of ammonia may lead to episodes of blurred vision. ",,,,"Mutations in the SLC25A15 gene result in a mitochondrial ornithine transporter that is unstable or the wrong shape, and which cannot bring ornithine to the mitochondrial matrix. This failure of ornithine transport causes an interruption of the urea cycle and the accumulation of ammonia, resulting in the signs and symptoms of ornithine translocase deficiency."
Osteopetrosis,,https://ghr.nlm.nih.gov/condition/osteopetrosis,,"Autosomal recessive osteopetrosis (ARO) is a more severe form of the disorder that becomes apparent in early infancy. Affected individuals have abnormally dense skull bones pinch nerves in the head and face (cranial nerves), often resulting in vision loss, ",,,,"Mutations in at least nine genes (CA2, CLCN7, IKBKG, ITGB3, OSTM1, PLEKHM1, TCIRG1, TNFRSF11A, TNFSF11)"
"Osteoporosis-pseudoglioma syndrome",,https://ghr.nlm.nih.gov/condition/osteoporosis-pseudoglioma-syndrome,,"Most affected individuals have impaired vision at birth or by early infancy and are blind by young adulthood. Vision problems are usually caused by one of several eye conditions, grouped together as pseudoglioma, that affect the light-sensitive tissue at the back of the eye (the retina), although other eye conditions have been identified in affected individuals. Pseudogliomas are so named because, on examination, the conditions resemble an eye tumor known as a retinal glioma.",,,,"LRP5 gene mutations that cause osteoporosis-pseudoglioma syndrome prevent cells from making any LRP5 protein or lead to a protein that cannot function. Loss of this protein's function disrupts the chemical signaling pathways that are needed for the formation of bone and for normal retinal development, leading to the bone and eye abnormalities characteristic of osteoporosis-pseudoglioma syndrome."
"Pallister-Killian mosaic syndrome",,https://ghr.nlm.nih.gov/condition/pallister-killian-mosaic-syndrome,,"Additional features of Pallister-Killian mosaic syndrome can include vision impairment,",,,,"Pallister-Killian mosaic syndrome is usually caused by the presence of an abnormal extra chromosome called an isochromosome 12p or i(12p). An isochromosome is a chromosome with two identical arms. Normal chromosomes have one long (q) arm and one short (p) arm, but isochromosomes have either two q arms or two p arms. Isochromosome 12p is a version of chromosome 12 made up of two p arms."
"Pantothenate kinase-associated neurodegeneration",,https://ghr.nlm.nih.gov/condition/pantothenate-kinase-associated-neurodegeneration,,"Some develop vision loss",,,,"Mutations in the PANK2 gene likely result in the production of an abnormal version of pantothenate kinase 2 or prevent cells from making any of this enzyme. A lack of functional pantothenate kinase 2 disrupts the production of coenzyme A and allows potentially harmful compounds to build up in the brain. This buildup leads to swelling and tissue damage, and allows iron to accumulate abnormally in certain parts of the brain. Researchers have not determined how these changes result in the specific features of pantothenate kinase-associated neurodegeneration. Because pantothenate kinase 2 functions in mitochondria, the signs and symptoms of this condition may be related to impaired energy production."
"Peroxisomal acyl-CoA oxidase deficiency",,https://ghr.nlm.nih.gov/condition/peroxisomal-acyl-coa-oxidase-deficiency,,"As the condition gets worse, affected children develop loss of vision . Most children with peroxisomal acyl-CoA oxidase deficiency do not survive past early childhood.",,,,"ACOX1 gene mutations prevent the peroxisomal straight-chain acyl-CoA oxidase enzyme from breaking down VLCFAs efficiently. As a result, these fatty acids accumulate in the body. It is unclear exactly how VLCFA accumulation leads to the specific features of peroxisomal acyl-CoA oxidase deficiency. However, researchers suggest that the abnormal fatty acid accumulation triggers inflammation in the nervous system that leads to the breakdown of myelin, which is the covering that protects nerves and promotes the efficient transmission of nerve impulses. Destruction of myelin leads to a loss of myelin-containing tissue (white matter) in the brain and spinal cord; loss of white matter is described as leukodystrophy. Leukodystrophy is likely involved in the development of the neurological abnormalities that occur in peroxisomal acyl-CoA oxidase deficiency."
"Peters anomaly",,https://ghr.nlm.nih.gov/condition/peters-anomaly,,"Eye problems that occur in an area at the front part of the eye known as the anterior segment. The anterior segment consists of structures including the lens, the colored part (iris) of the eye, and the clear covering of the eye (cornea). During development of the eye, the elements of the anterior segment form separate structures. However, in Peters anomaly, development of the anterior segment is abnormal, leading to incomplete separation of the cornea from the iris or the lens. As a result, the cornea is cloudy (opaque), which causes blurred vision. The opaque area (opacity) of the cornea varies in size and intensity from a small, faint streak to a large, white cloudy area that covers the front surface of the eye. Additionally, the location of the opacity varies; the cloudiness may be at the center of the cornea or off-center. Large, centrally located opacities tend to cause poorer vision than smaller, off-center ones. Nearly half of the individuals affected with Peters anomaly have low vision early in life and about a quarter are legally blind. Due to a lack of visual stimulation, some individuals develop ""lazy eye"" (amblyopia). Peters anomaly is often associated with other eye problems, such as increased pressure within the eye (glaucoma), clouding of the lens (cataract), and unusually small eyeballs (microphthalmia). In most cases, Peters anomaly is bilateral, which means that it affects both eyes, although the level of vision impairment may be different in each eye. These individuals may have eyes that do not point in the same direction (strabismus). In some people with Peters anomaly, corneal clouding improves over time leading to improved vision.",,,,"Mutations in the FOXC1, PAX6, PITX2, or CYP1B1 gene can cause Peters anomaly.Mutations in any of these four genes disrupt development of the anterior segment of the eye. These mutations can lead to severe developmental problems, such as incomplete separation of eye structures and complete corneal opacity, or they can result in minor eye abnormalities including small, faint opacities. It is likely that mutations that cause a complete absence of protein function result in the most severe eye problems. It is unknown why both eyes are affected in some cases and in others only one eye is abnormal.In many cases of Peters anomaly, there is no mutation identified in any of these four genes. The cause of the condition in these cases is unknown."
"Pitt-Hopkins syndrome",,https://ghr.nlm.nih.gov/condition/pitt-hopkins-syndrome,,"Other features of Pitt-Hopkins syndrome may include nearsightedness (myopia), eyes that do not look in the same direction (strabismus), ",,,,"TCF4 gene mutations disrupt the protein's ability to bind to DNA and control the activity of certain genes. These disruptions, particularly the inability of the TCF4 protein to control the activity of genes involved in nervous system development and function, contribute to the signs and symptoms of Pitt-Hopkins syndrome. Furthermore, additional proteins interact with the TCF4 protein to carry out specific functions. When the TCF4 protein is nonfunctional, these other proteins are also unable to function normally. It is also likely that the loss of the normal proteins that are attached to the nonfunctional TCF4 proteins contribute to the features of this condition. The loss of one protein in particular, the ASCL1 protein, is thought to be associated with breathing problems in people with Pitt-Hopkins syndrome."
"Pol III-related leukodystrophy",,https://ghr.nlm.nih.gov/condition/pol-iii-related-leukodystrophy,,"People with Pol III-related leukodystrophy often have abnormalities in eye movement, such as progressive vertical gaze palsy, which is restricted up-and-down eye movement that worsens over time. Nearsightedness is common in affected individuals, and clouding of the lens of the eyes (cataracts) has also been reported.",,,,"Researchers suggest that mutations in the POLR3A or POLR3B gene may impair the ability of subunits of the RNA polymerase III enzyme to assemble properly or result in an RNA polymerase III with impaired ability to bind to DNA. Reduced function of the RNA polymerase III molecule likely affects development and function of many parts of the body, including the nervous system and the teeth, but the relationship between POLR3A and POLR3B gene mutations and the specific signs and symptoms of Pol III-related leukodystrophy is unknown."
"Polycythemia vera",,https://ghr.nlm.nih.gov/condition/polycythemia-vera,,"Some people with polycythemia vera experience impaired vision, ",,,,"Mutations in the JAK2 and TET2 genes "
"Pontocerebellar hypoplasia",,https://ghr.nlm.nih.gov/condition/pontocerebellar-hypoplasia,,"Individuals with PCH1 also have vision impairment,",,,,"Pontocerebellar hypoplasia can result from mutations in several genes (AMPD2, CHMP1A, CLP1, EXOSC3, RARS2, SEPSECS, TSEN2, TSEN34, TSEN54, VRK1). About half of all cases of PCH1 are caused by mutations in the EXOSC3 gene. PCH1 can also result from mutations in several other genes, including TSEN54, RARS2, and VRK1. PCH2 is caused by mutations in the TSEN54, TSEN2, TSEN34, or SEPSECS gene. In addition to causing PCH1 and PCH2, mutations in the TSEN54 gene can cause PCH4 and PCH5. "
"Potocki-Lupski syndrome",,https://ghr.nlm.nih.gov/condition/potocki-lupski-syndrome,,"Other signs and symptoms of Potocki-Lupski syndrome can include vision problems, ",,,,"Potocki-Lupski syndrome results from a duplication of genetic material at 17p11.2. In about two-thirds of affected individuals, the duplicated segment includes approximately 3.7 million DNA building blocks (base pairs), also written as 3.7 megabases (Mb). (A deletion of this segment causes a related condition called Smith-Magenis syndrome.) In the remaining one-third of cases, the duplication is larger or smaller, ranging from less than 1 Mb to almost 20 Mb. All of these duplications affect one of the two copies of chromosome 17 in each cell.Although the duplicated region contains multiple genes, researchers believe that having an extra copy of one particular gene, RAI1, underlies many of the characteristic features of Potocki-Lupski syndrome. Extra copies of other genes at 17p11.2 likely also contribute to the features of this di (ALX4, EXT2, PHF21A)sorder; the role of these genes is under study."
Preeclampsia,,https://ghr.nlm.nih.gov/condition/preeclampsia,,"Vision changes may develop, including flashing lights or spots, increased sensitivity to light (photophobia), blurry vision, or temporary blindness.",,,,"The specific causes of preeclampsia are not well understood. "
"Primary coenzyme Q10 deficiency",,https://ghr.nlm.nih.gov/condition/primary-coenzyme-q10-deficiency,,"Other neurological abnormalities that can occur in primary coenzyme Q10 deficiency include abnormal eye movements (nystagmus), vision loss caused by degeneration (atrophy) of the optic nerves or breakdown of the light-sensing tissue at the back of the eyes (retinopathy), and sensorineural hearing loss (which is caused by a with coenzyme Q10 supplementation.",,,,"Primary coenzyme Q10 deficiency is caused by mutations in genes that provide instructions for making proteins involved in the production (synthesis) of a molecule called coenzyme Q10. Collectively, they are called the COQ genes. Most of the identified mutations have occurred in the COQ2, COQ4, COQ6, COQ8A, and COQ8B genes. Smaller numbers of mutations in other COQ genes have also been found to cause primary coenzyme Q10 deficiency."
"Progressive supranuclear palsy",,https://ghr.nlm.nih.gov/condition/progressive-supranuclear-palsy,,"Progressive supranuclear palsy is a brain disorder that affects movement, vision, Progressive supranuclear palsy is also characterized by abnormal eye movements, which typically develop several years after the other movement problems first appear. Restricted up-and-down eye movement (vertical gaze palsy) is a hallmark of this disease. Other eye movement problems include difficulty opening and closing the eyelids, infrequent blinking, and pulling back (retraction) of the eyelids. These abnormalities can lead to blurred vision, an increased sensitivity to light (photophobia), and a staring gaze.",,,,"In most cases, the genetic cause of progressive supranuclear palsy is unknown. Rarely, the disease results from mutations in the MAPT gene. In people with MAPT gene mutations, genetic changes disrupt the protein's normal structure and function. However, abnormal tau is also found in affected individuals without MAPT gene mutations. The defective tau protein assembles into abnormal clumps within neurons and other brain cells, although it is unclear what effect these clumps have on cell function and survival. Progressive supranuclear palsy is characterized by the gradual death of brain cells, particularly in structures deep within the brain that are essential for coordinating movement. This loss of brain cells underlies the movement abnormalities and other features of progressive supranuclear palsy."
"Proteus syndrome",,https://ghr.nlm.nih.gov/condition/proteus-syndrome,,"Some people with Proteus syndrome have neurological abnormalities, including vision loss. ",,,,"Proteus syndrome results from a mutation in the AKT1 gene. This genetic change is not inherited from a parent; it arises randomly in one cell during the early stages of development before birth. As cells continue to grow and divide, some cells will have the mutation and other cells will not. This mixture of cells with and without a genetic mutation is known as mosaicism.A mutation in this gene disrupts a cell's ability to regulate its own growth, allowing it to grow and divide abnormally. Increased cell proliferation in various tissues and organs leads to the abnormal growth characteristic of Proteus syndrome. Studies suggest that an AKT1 gene mutation is more common in groups of cells that experience overgrowth than in the parts of the body that grow normally."
"Pseudoxanthoma elasticum",,https://ghr.nlm.nih.gov/condition/pseudoxanthoma-elasticum,,"Bleeding and scarring of the retina may also occur, which can cause vision loss.",,,,"Mutations in the ABCC6 gene lead to an absent or nonfunctional MRP6 protein. It is unclear how a lack of properly functioning MRP6 protein leads to PXE. "
"Refsum disease",,https://ghr.nlm.nih.gov/condition/refsum-disease,,"An inherited condition that causes vision loss,The vision loss associated with Refsum disease is caused by an eye disorder called retinitis pigmentosa. This disorder affects the retina, the light-sensitive layer at the back of the eye. Vision loss occurs as the light-sensing cells of the retina gradually deteriorate. The first sign of retinitis pigmentosa is usually a loss of night vision, which often becomes apparent in childhood. Over a period of years, the disease disrupts side (peripheral) vision and may eventually lead to blindness.",,,,"More than 90 percent of all cases of Refsum disease result from mutations in the PHYH gene. The remaining cases are caused by mutations in a gene called PEX7.Mutati ons in either the PHYH or PEX7 gene disrupt the usual functions of peroxisomes, including the breakdown of phytanic acid. As a result, this substance builds up in the body's tissues. The accumulation of phytanic acid is toxic to cells, although it is unclear how an excess of this substance affects vision and smell and causes the other specific features of Refsum disease."
"Renal coloboma syndrome",,https://ghr.nlm.nih.gov/condition/renal-coloboma-syndrome,,"people with renal coloboma syndrome may have a malformation in the optic nerve, a structure that carries information from the eye to the brain. Optic nerve malformations are sometimes associated with a gap or hole (coloboma) in the light-sensitive tissue at the back of the eye (the retina). The vision problems caused by these abnormalities can vary depending on the size and location of the malformation. Some people have no visual problems, while others may have severely impaired vision.",,,,"Mutations in the PAX2 gene lead to the production of a nonfunctional PAX2 protein that is unable to aid in development, causing incomplete formation of certain tissues. Why the kidneys and eyes are specifically affected by PAX2 gene mutations is unclear."
"Retinal arterial macroaneurysm with supravalvular pulmonic stenosis",,https://ghr.nlm.nih.gov/condition/retinal-arterial-macroaneurysm-with-supravalvular-pulmonic-stenosis,,"RAMSVPS damages the arteries in the light-sensitive tissue at the back of the eye (the retina). These arteries gradually develop multiple small bulges called beading. Eventually, larger bulges in the blood vessel walls (macroaneurysms) occur. These macroaneurysms can tear (rupture), leading to bleeding that can spread into other areas of the eye and cause vision loss",,,,"The IGFBP7 gene mutation that causes RAMSVPS results in an abnormally short IGFBP7 protein that does not function properly. Without normally functioning IGFBP7 protein to control BRAF signaling, this signaling is increased. It is unknown how this increase is related to the specific blood vessel abnormalities that occur in RAMSVPS, or why these abnormalities are confined to the eyes and the pulmonary artery. Researchers suggest that differences in normal levels of IGFBP7 protein in various parts of the body or the presence of other proteins with a similar function in different tissues may account for the specific signs and symptoms of this disorder."
"Retinitis pigmentosa",,https://ghr.nlm.nih.gov/condition/retinitis-pigmentosa,,"A group of related eye disorders that cause progressive vision loss. In people with retinitis pigmentosa, vision loss occurs as the light-sensing cells of the retina gradually deteriorate.The first sign of retinitis pigmentosa is usually a loss of night vision, which becomes apparent in childhood. Problems with night vision can make it difficult to navigate in low light. Later, the disease causes blind spots to develop in the side (peripheral) vision. Over time, these blind spots merge to produce tunnel vision. The disease progresses over years or decades to affect central vision, which is needed for detailed tasks such as reading, driving, and recognizing faces. In adulthood, many people with retinitis pigmentosa become legally blind.",,,,"Mutations in more than 60 genes are known to cause nonsyndromic retinitis pigmentosa.(ABCA4, BEST1, C2orf71, CA4, CERKL, CLRN1, CNGA1, CNGB1, CRB1, CRX, EYS, FAM161A, FSCN2, GUCA1B, IDH3B, IMPDH1, IMPG2, KLHL7, LRAT, MERTK, MT-TS2, NR2E3, NRL, PDE6A, PDE6B, PDE6G, PRCD, PROM1, PRPF3, PRPF8, PRPF31, PRPH2, RBP3, RDH12, RGR, RHO, RLBP1, ROM1, RP1, RP2, RP9, RPE65, RPGR, SAG, SEMA4A, SNRNP200, SPATA7, TOPORS, TTC8, TULP1, USH2A, WDR19, ZNF51) More than 20 of these genes are associated with the autosomal dominant form of the disorder. Mutations in the RHO gene are the most common cause of autosomal dominant retinitis pigmentosa, accounting for 20 to 30 percent of all cases. At least 35 genes have been associated with the autosomal recessive form of the disorder. The most common of these is USH2A; mutations in this gene are responsible for 10 to 15 percent of all cases of autosomal recessive retinitis pigmentosa. Changes in at least six genes are thought to cause the X-linked form of the disorder. Together, mutations in the RPGR and RP2 genes account for most cases of X-linked retinitis pigmentosa."
Retinoblastoma视网膜母细胞瘤,,https://ghr.nlm.nih.gov/condition/retinoblastoma,,"Retinoblastoma is a rare type of eye cancer that usually develops in early childhood, typically before the age of 5. This form of cancer develops in the retina, Retinoblastoma is often curable when it is diagnosed early. However, if it is not treated promptly, this cancer can spread beyond the eye to other parts of the body. This advanced form of retinoblastoma can be life-threatening.",,,,"Mutations in the RB1 gene are responsible for most cases of retinoblastoma. Most mutations in the RB1 gene prevent it from making any functional protein, so cells are unable to regulate cell division effectively. As a result, certain cells in the retina can divide uncontrollably to form a cancerous tumor. Some studies suggest that additional genetic changes can influence the development of retinoblastoma; these changes may help explain variations in the development and growth of retinoblastoma and other types of tumors in different people.A small percentage of retinoblastomas are caused by deletions in the region of chromosome 13 teg MYCN hat contains the RB1 gene. "
